label|,|ques
H/脱贫,H/组织专家义诊|,|省医学保健养生研究会党委组织开展健康扶贫义诊活动
H/帮扶|,|肥东县白龙镇科协为果蔬种植户送防寒保收秘诀”
H/走访调研|,|肥东县督查调研乡镇科协工作
H/走访调研|,|肥东县科协部署农技协专项资金使用管理自查自纠和乡镇科协督查调研工作
H/精准扶贫|,|肥东科协助推企业科技精准扶贫
H/慰问|,|肥东县老科协慰问有突出贡献的优秀老科技工作者
H/调查|,|肥东县开展青少年科学调查体验活动
H/座谈会|,|巢湖市科协组织召开礼赞共和国 智慧新生活”科技工作者座谈会
H/走访调研|,|魏军锋到巢湖市科协调研
H/座谈会|,|合肥市科协召开学会工作座谈会
H/慰问|,|庐江县开展走访慰问科技工作者代表活动
H/组织专家义诊|,|全国第二十四届肿瘤防治抗癌周大型义诊活动庐江县站
H/精准扶贫|,|庐江县食用菌协会召开精准扶贫工作推进会
H/脱贫|,|庐江县科协开展脱贫攻坚工作
H/慰问|,|庐江县食用菌协会开展春节慰问困难会员活动
H/精准扶贫|,|庐江县食用菌协会精准扶贫工作受合肥市政协领导高度肯定
H/灾后农业生产自救|,|庐江县食用菌协会积极开展灾后科普服务
H/知识宣传,H/灾后农业生产自救|,|庐江县郭河镇科协积极开展灾后科普宣传
H/慰问|,|长丰县领导慰问科技工作者代表
H/慰问|,|蔡士祥到长丰县岗集镇看望省科协挂职干部慰问困难党员
H/座谈会|,|长丰县召开青少年科技创新工作座谈会
H/脱贫|,|长丰县科协送科技到包联贫困户
H/走访调研|,|长丰县政协开展科普工作专题调研活动
H/帮扶|,|王海彦赴长丰县岗集镇调研江淮分水岭对口帮扶工作
H/走访调研|,|王洵赴长丰县岗集镇调研江淮分水岭综合开发治理工作
H/帮扶|,|六安市裕安区科协赴合肥市包河区科技局开展扶贫结对帮扶活动
H/调查|,|2018年芜湖市青少年科学调查体验活动启动
H/调查|,|芜湖县赵桥小学举行2018年青少年科学调查体验活动启动仪式
H/走访调研|,|中国科协农技中心农技协发展处来皖调研芜湖农技协工作
H/精准扶贫|,|芜湖市科协发挥农技协优势科技助力精准扶贫
H/调查|,|芜湖市2016年全国青少年科学调查体验活动启动仪式举行
H/组织专家义诊|,|无为县护理学会开展纪念512国际护士节大型义诊活动
H/帮扶|,|安庆市望江县科协赴芜湖市镜湖区对接帮扶工作
H/精准扶贫|,|科技助力 精准扶贫” 合肥蜀山科协精准科普进寿县
H/慰问|,|五河县领导看望慰问优秀科技工作者代表
H/调查|,|桐城市东关小学2019青少年科学调查体验活动启动
H/扶贫|,|桐城创新机制 提升科技扶贫实效
H/慰问|,|桐城市领导走访慰问基层一线科技工作者
H/走访调研|,|中国科协科普部基层处调研安庆市科普信息化落地应用工作
H/走访调研|,|桐城市科协组队赴浙江余姚考察学习
H/脱贫|,|桐城市科协召开脱贫攻坚推进会
H/脱贫|,|桐城市科协党员活动日”开展脱贫攻坚入户走访
